{
 "animations": [
  {
   "duration": 0.4,
   "loop": false,
   "name": "squash",
   "tracks": [
    {
     "keys": [
      {
       "t": 0,
       "value": [
        1,
        1,
        1
       ]
      },
      {
       "t": 0.08,
       "value": [
        1.25,
        0.6,
        1.25
       ]
      },
      {
       "t": 0.22,
       "value": [
        0.9,
        1.15,
        0.9
       ]
      },
      {
       "t": 0.4,
       "value": [
        1,
        1,
        1
       ]
      }
     ],
     "part": "base",
     "path": "scale"
    }
   ]
  }
 ],
 "budget": {
  "max_triangles": 4000
 },
 "collision": {
  "shape": "convex"
 },
 "fit": {
  "axis": "y",
  "size": 0.8
 },
 "materials": [
  {
   "color": "#2CA5A5",
   "id": "teal",
   "roughness": 0.55
  },
  {
   "color": "#1F8A8A",
   "id": "teal-mid",
   "roughness": 0.7
  },
  {
   "color": "#F7F1E3",
   "id": "cream",
   "roughness": 0.6
  },
  {
   "color": "#D8CDB8",
   "id": "stone",
   "roughness": 0.8
  },
  {
   "color": "#26211C",
   "id": "ink",
   "roughness": 0.9
  }
 ],
 "parts": [
  {
   "bevel": 0.02,
   "id": "base",
   "material": "stone",
   "position": [
    0,
    0.05,
    0
   ],
   "segments": 16,
   "shape": "cylinder",
   "size": [
    0.8,
    0.1,
    0.8
   ]
  },
  {
   "bevel": 0.02,
   "id": "stem",
   "material": "teal-mid",
   "parent": "base",
   "position": [
    0,
    0.18,
    0
   ],
   "segments": 12,
   "shape": "cylinder",
   "size": [
    0.6,
    0.3,
    0.6
   ],
   "taper": [
    0.8,
    0.8
   ]
  },
  {
   "id": "shadow-gap",
   "material": "ink",
   "parent": "base",
   "position": [
    0,
    0.33,
    0
   ],
   "segments": 12,
   "shape": "cylinder",
   "size": [
    0.5,
    0.04,
    0.5
   ]
  },
  {
   "id": "cap",
   "material": "teal",
   "parent": "base",
   "position": [
    0,
    0.42,
    0
   ],
   "segments": 16,
   "shape": "sphere",
   "size": [
    1.2,
    0.6,
    1.2
   ]
  },
  {
   "bevel": 0.02,
   "id": "ring",
   "material": "cream",
   "parent": "base",
   "position": [
    0,
    0.68,
    0
   ],
   "segments": 16,
   "shape": "cylinder",
   "size": [
    0.66,
    0.1,
    0.66
   ]
  },
  {
   "id": "nub",
   "material": "teal",
   "parent": "base",
   "position": [
    0,
    0.74,
    0
   ],
   "segments": 12,
   "shape": "sphere",
   "size": [
    0.4,
    0.22,
    0.4
   ]
  }
 ]
}